<?xml version="1.0" ?>
<template xmlns="http://schemas.sulu.io/template/template"
          xmlns:xsi="http://www.w3.org/2001/XMLSchema-instance"
          xsi:schemaLocation="http://schemas.sulu.io/template/template http://schemas.sulu.io/template/template-1.0.xsd">

    <key>default-example-selection</key>

    <view>@ExampleTest/examples/default</view>
    <controller>Sulu\Content\UserInterface\Controller\Website\ContentController::indexAction</controller>
    <cacheLifetime>604800</cacheLifetime>

    <meta>
        <title lang="en">Example</title>
        <title lang="de">Example</title>
    </meta>

    <properties>
        <property name="title" type="text_line" mandatory="true">
            <meta>
                <title lang="en">Title</title>
                <title lang="de">Titel</title>
            </meta>

            <params>
                <param name="headline" value="true"/>
            </params>

            <tag name="sulu.rlp.part"/>
            <tag name="sulu.search.field" role="title"/>
        </property>

        <property name="url" type="route">
            <meta>
                <title lang="en">Resourcelocator</title>
                <title lang="de">Adresse</title>
            </meta>

            <tag name="sulu.rlp"/>
            <tag name="sulu.search.field" role="url"/>
        </property>

        <property name="description" type="text_area">
            <meta>
                <title lang="en">Description</title>
                <title lang="de">Beschreibung</title>
            </meta>

            <tag name="sulu.search.field" role="description"/>
        </property>

        <property name="image" type="single_media_selection">
            <meta>
                <title lang="en">Image</title>
                <title lang="de">Bild</title>
            </meta>

            <tag name="sulu.search.field" role="image"/>
        </property>

        <property name="examples" type="example_selection">
            <meta>
                <title lang="en">Page</title>
                <title lang="de">Seite</title>
            </meta>
        </property>

        <property name="examples_with_properties" type="example_selection">
            <meta>
                <title lang="en">Page with properties</title>
                <title lang="de">Seite mit Properties</title>
            </meta>

            <params>
                <param name="properties" type="collection">
                    <param name="id" value="object.id"/>
                    <param name="title" value="title"/>
                    <param name="description" value="description"/>
                    <param name="excerptTitle" value="excerpt.title"/>
                    <param name="excerptDescription" value="excerpt.description"/>
                    <param name="seoTitle" value="seo.title"/>
                    <param name="seoDescription" value="seo.description"/>
                </param>
            </params>
        </property>
    </properties>
</template>
