<?xml version="1.0" ?>
<template xmlns="http://schemas.sulu.io/template/template"
          xmlns:xsi="http://www.w3.org/2001/XMLSchema-instance"
          xsi:schemaLocation="http://schemas.sulu.io/template/template http://schemas.sulu.io/template/template-1.0.xsd"
>
    <key>overview</key>

    <view>pages/default</view>
    <controller>Sulu\Content\UserInterface\Controller\Website\ContentController::indexAction</controller>
    <cacheLifetime>2400</cacheLifetime>

    <properties>
        <property name="title" type="text_line" mandatory="false">
            <tag name="sulu.rlp.part" />
        </property>
        <property name="tags" type="text_line" minOccurs="2" maxOccurs="10"/>
        <property name="url" type="route" mandatory="false">
            <tag name="sulu.rlp" />
        </property>
        <property name="article" type="text_area" mandatory="false"/>
        <property name="blog" type="text_area" mandatory="false"/>
        <property name="external_url" type="url" mandatory="false" />
        <property name="internal_link" type="page_selection" mandatory="false" />
    </properties>
</template>
