<?xml version="1.0" ?>
<template xmlns="http://schemas.sulu.io/template/template"
          xmlns:xsi="http://www.w3.org/2001/XMLSchema-instance"
          xsi:schemaLocation="http://schemas.sulu.io/template/template http://schemas.sulu.io/template/template-1.0.xsd">

    <key>template_sections</key>

    <view>page.html.twig</view>
    <controller>SuluPageBundle:Default:index</controller>
    <cacheLifetime>2400</cacheLifetime>

    <properties>
        <property name="title" type="text_line" mandatory="true" colspan="6">
            <meta>
                <title lang="de">Titel</title>
                <title lang="en">Title</title>

                <info_text lang="de">Titel-Info-DE</info_text>
                <info_text lang="en">Title-Info-EN</info_text>

                <placeholder lang="de">Platzhalter-Info-DE</placeholder>
                <placeholder lang="en">Placeholder-Info-EN</placeholder>
            </meta>
            <tag name="sulu.node.title" priority="10"/>
        </property>

        <section name="test" cssClass="test">
            <meta>
                <title lang="de">Test-DE</title>
                <title lang="en">Test-EN</title>

                <info_text lang="de">Info-DE</info_text>
                <info_text lang="en">Info-EN</info_text>
            </meta>
            <properties>
                <property name="url" type="route" mandatory="true" cssClass="test"
                          colspan="6">
                    <tag name="sulu.rlp" priority="1"/>
                </property>
                <property name="article" type="text_area" mandatory="false" colspan="6">
                    <tag name="sulu.node.title" priority="5"/>
                </property>
                <block name="block" default-type="test">
                    <meta>
                        <title lang="de">Block-DE</title>
                        <title lang="en">Block-EN</title>

                        <info_text lang="de">Block-Info-DE</info_text>
                        <info_text lang="en">Block-Info-EN</info_text>
                    </meta>
                    <types>
                        <type name="test">
                            <properties>
                                <property name="name" type="text_line"/>
                            </properties>
                        </type>
                    </types>
                </block>
            </properties>
        </section>

        <property name="pages" type="smart_content_selection" mandatory="false">
            <tag name="sulu.node.title"/>
        </property>

        <property name="images" type="image_selection" minOccurs="0" maxOccurs="2" colspan="6">
            <params>
                <param name="minLinks" value="1"/>
                <param name="maxLinks" value="10"/>
            </params>
        </property>
    </properties>
</template>
