<?xml version="1.0" ?>
<template xmlns="http://schemas.sulu.io/template/template"
          xmlns:xsi="http://www.w3.org/2001/XMLSchema-instance"
          xsi:schemaLocation="http://schemas.sulu.io/template/template http://schemas.sulu.io/template/template-1.0.xsd">

    <key>template</key>

    <view>page.html.twig</view>
    <controller>SuluPageBundle:Default:index</controller>
    <cacheLifetime>2400</cacheLifetime>
    <index name="foo_index" />

    <internal>true</internal>

    <meta>
        <title lang="de">Das ist das Template 1</title>
        <title lang="en">That´s the template 1</title>
    </meta>

    <tag name="some.random.structure.tag" foo="bar" bar="foo"/>

    <properties>
        <property name="title" type="text_line" mandatory="true">
            <meta>
                <title lang="de">Titel</title>
                <title lang="en">Title</title>

                <info_text lang="de">Titel-Info-DE</info_text>
                <info_text lang="en">Title-Info-EN</info_text>

                <placeholder lang="de">Platzhalter-Info-DE</placeholder>
                <placeholder lang="en">Placeholder-Info-EN</placeholder>
            </meta>

            <indexField />

            <tag name="sulu.node.title" priority="10"/>

            <tag name="some.random.tag" one="1" two="2" three="three" />
        </property>

        <property name="url" type="route" mandatory="true">
            <tag name="sulu.rlp" priority="1"/>
        </property>

        <property name="article" type="text_area" mandatory="false">
            <tag name="sulu.node.title" priority="5"/>
        </property>

        <property name="pages" type="smart_content_selection" mandatory="false">
            <tag name="sulu.node.title"/>
        </property>

        <property name="article_number" type="text_line" multilingual="false"/>

        <property name="images" type="image_selection" minOccurs="0" maxOccurs="2">
            <params>
                <param name="minLinks" value="1"/>
                <param name="maxLinks" value="10"/>
                <param name="displayOptions" type="collection">
                    <param name="leftTop" value="true"/>
                    <param name="top" value="false"/>
                    <param name="rightTop" value="true"/>
                    <param name="left" value="false"/>
                    <param name="middle" value="false"/>
                    <param name="right" value="false"/>
                    <param name="leftBottom" value="true"/>
                    <param name="bottom" value="false"/>
                    <param name="rightBottom" value="true"/>
                </param>
            </params>
        </property>
    </properties>
</template>
