<?xml version="1.0" ?>

<template xmlns="http://schemas.sulu.io/template/template"
          xmlns:xsi="http://www.w3.org/2001/XMLSchema-instance"
          xsi:schemaLocation="http://schemas.sulu.io/template/template http://schemas.sulu.io/template/template-1.0.xsd"
          >

    <key>default</key>

    <view>ClientWebsiteBundle:templates:animals</view>
    <controller>Sulu\Bundle\WebsiteBundle\Controller\DefaultController::indexAction</controller>
    <cacheLifetime>2400</cacheLifetime>

    <meta>
        <title lang="de">Tiers</title>
        <title lang="en">Animals</title>
    </meta>

    <tag name="test" value="test-value"/>
    <tag name="test2" test="test-value2"/>
    <tag name="test3" value="test-value"/>

    <schema>
        <anyOf>
            <schema>
                <properties>
                    <property name="blog" mandatory="true"/>
                </properties>
            </schema>
            <schema>
                <properties>
                    <property name="localized_blog" mandatory="true"/>
                </properties>
            </schema>
        </anyOf>
    </schema>

    <properties>
        <property name="title" type="text_line" mandatory="true">
            <meta>
                <title lang="de">Tier</title>
                <title lang="en">Animals</title>
            </meta>

            <tag name="sulu.rlp.part" priority="100"/>
        </property>

        <property name="url" type="resource_locator" mandatory="true">
            <meta>
                <title lang="de">Adresse</title>
                <title lang="en">Resourcelocator</title>
            </meta>

            <tag name="sulu.rlp"/>
        </property>

        <!-- TODO readd ? https://github.com/sulu/sulu/pull/7794
        <property name="animals" type="snippet_selection">
            <params>
                <param name="snippetType" value="animal" />
            </params>

            <meta>
                <title lang="de">Tiers</title>
                <title lang="en">Animals</title>
            </meta>
        </property>
        -->

        <property name="blog" type="text_area" multilingual="false" mandatory="false"/>

        <property name="localized_blog" type="text_area" mandatory="false"/>

        <section name="content">
            <properties>
                <block name="blocks" default-type="text_block" minOccurs="0">
                    <types>
                        <type ref="text_block"/>
                        <type ref="text_block2"/>
                        <type name="editor">
                            <meta>
                                <title lang="en">Editor</title>
                                <title lang="de">Editor</title>
                            </meta>
                            <properties>
                                <property name="text_editor" type="text_editor">
                                    <meta>
                                        <title lang="en">Text Editor</title>
                                        <title lang="de">Texteditor</title>
                                    </meta>
                                </property>
                            </properties>
                        </type>
                        <type name="block">
                            <properties>
                                <property name="title" type="text_line"/>
                                <block name="blocks" default-type="text_block2" minOccurs="0">
                                    <types>
                                        <type ref="text_block2"/>
                                        <type ref="text_block3"/>
                                    </types>
                                </block>
                            </properties>
                        </type>
                    </types>
                </block>
            </properties>
        </section>
    </properties>
</template>
