<?xml version="1.0" ?>
<template xmlns="http://schemas.sulu.io/template/template"
          xmlns:xsi="http://www.w3.org/2001/XMLSchema-instance"
          xsi:schemaLocation="http://schemas.sulu.io/template/template http://schemas.sulu.io/template/template-1.0.xsd">

    <key>blocks-with-custom-settings</key>

    <view>@ExampleTest/examples/default</view>
    <controller>Sulu\Content\UserInterface\Controller\Website\ContentController::indexAction</controller>

    <meta>
        <title lang="en">Custom Settings Template</title>
        <title lang="de">Template mit benutzerdefinierten Einstellungen</title>
    </meta>

    <properties>
        <property name="title" type="text_line" mandatory="true">
            <meta>
                <title lang="en">Title</title>
                <title lang="de">Titel</title>
            </meta>

            <tag name="sulu.search.field" role="title"/>
        </property>

        <property name="url" type="route" mandatory="true">
            <meta>
                <title lang="en">Resourcelocator</title>
                <title lang="de">Adresse</title>
            </meta>

            <tag name="sulu.rlp"/>
        </property>

        <block name="blocks_with_custom_settings_form_key" default-type="editor" minOccurs="0">
            <meta>
                <title lang="en">Content with Custom Settings</title>
                <title lang="de">Inhalte mit benutzerdefinierten Einstellungen</title>
            </meta>

            <params>
                <param name="settings_form_key" value="custom_block_settings" />
            </params>

            <types>
                <type name="editor">
                    <meta>
                        <title lang="en">Editor</title>
                        <title lang="de">Editor</title>
                    </meta>
                    <properties>
                        <property name="text_editor" type="text_editor">
                            <meta>
                                <title lang="en">Text Editor</title>
                                <title lang="de">Texteditor</title>
                            </meta>
                        </property>
                    </properties>
                </type>
            </types>
        </block>
    </properties>
</template>
